{
  "$schema": "https://json-schema.org/draft/2020-12/schema",
  "$id": "family.schema.json",
  "title": "Model family",
  "description": "A display grouping of models (one chip on the map). Holds no technical properties.",
  "type": "object",
  "additionalProperties": false,
  "required": [
    "id",
    "name",
    "summary",
    "summary_source"
  ],
  "properties": {
    "id": {
      "type": "string",
      "pattern": "^[a-z0-9]+(-[a-z0-9]+)*$"
    },
    "name": {
      "type": "string",
      "minLength": 1
    },
    "summary": {
      "type": [
        "string",
        "null"
      ],
      "description": "One-line educational description. LLM-drafted text must be human-approved.",
      "maxLength": 300
    },
    "summary_source": {
      "type": [
        "string",
        "null"
      ],
      "enum": [
        "ai",
        "curated",
        null
      ]
    }
  }
}
