{
  "id": "indextts",
  "name": "IndexTTS",
  "summary": "IndexTeam developed IndexTTS, a text-to-speech model that generates speech in several languages and can clone a voice from a single audio clip. It exists to turn written text into speech with control over voice and emotion.",
  "summary_source": "ai"
}
