{
  "id": "higgs-tts",
  "name": "Higgs TTS",
  "summary": "Boson AI built Higgs TTS, a text-to-speech model that turns text into expressive conversational speech. It is designed for voice chat, where responses should sound like conversation rather than simply being read aloud.",
  "summary_source": "ai"
}
